{
	"$schema": "http://json-schema.org/draft-07/schema#",
	"$id": "foundry-class.json",
	"version": "1.3.5",
	"type": "object",
	"definitions": {
		"entryDataObject": {
			"description": "Additional \"5etools-type\" data to be stored on the entry.",
			"type": "object",
			"properties": {
				"languageProficiencies": {
					"$ref": "../util.json#/definitions/languageProficiencies"
				},
				"skillProficiencies": {
					"$ref": "../util.json#/definitions/skillProficiencies"
				},
				"weaponProficiencies": {
					"$ref": "../util.json#/definitions/weaponProficiencies"
				},
				"armorProficiencies": {
					"$ref": "../util.json#/definitions/armorProficiencies"
				},
				"toolProficiencies": {
					"$ref": "../util.json#/definitions/toolProficiencies"
				},
				"savingThrowProficiencies": {
					"$ref": "../util.json#/definitions/savingThrowProficiencies"
				},
				"expertise": {
					"$ref": "../util.json#/definitions/expertise"
				},
				"resist": {
					"$ref": "../util.json#/definitions/damageResistArrayPlayer"
				},
				"immune": {
					"$ref": "../util.json#/definitions/damageImmunityArrayPlayer"
				},
				"vulnerable": {
					"$ref": "../util.json#/definitions/damageVulnerabilityArrayPlayer"
				},
				"conditionImmune": {
					"$ref": "../util.json#/definitions/conditionImmunityArrayPlayer"
				},
				"resources": {
					"$ref": "../util.json#/definitions/resourcesArray"
				},
				"senses": {
					"$ref": "../util.json#/definitions/sensesArray"
				}
			},
			"additionalProperties": false
		}
	},
	"properties": {
		"class": {
			"type": "array",
			"items": {
				"type": "object",
				"properties": {
					"name": {
						"type": "string"
					},
					"source": {
						"type": "string"
					},
					"entries": {
						"type": "array",
						"items": {
							"$ref": "../entry.json"
						}
					},
					"entryData": {
						"$ref": "#/definitions/entryDataObject"
					},
					"data": {
						"$ref": "../util.json#/definitions/foundryDataObject"
					},
					"flags": {
						"$ref": "../util.json#/definitions/foundryFlagsObject"
					},
					"advancement": {
						"$ref": "../util.json#/definitions/foundryAdvancementsArray"
					},
					"chooseData": {
						"type": "array",
						"items": {
							"$ref": "../util.json#/definitions/foundryDataObject"
						}
					},
					"isChooseDataRenderEntries": {
						"type": "boolean"
					},
					"isIgnored": {
						"const": true
					},
					"actorDataMod": {
						"type": "object"
					},
					"actorTokenMod": {
						"type": "object"
					},
					"effects": {
						"$ref": "../util.json#/definitions/foundryEffectsArray"
					},
					"img": {
						"type": "string"
					},
					"subEntities": {
						"$ref": "../util.json#/definitions/foundrySubEntitiesObject"
					}
				},
				"required": [
					"name",
					"source"
				],
				"additionalProperties": false
			}
		},
		"subclass": {
			"type": "array",
			"items": {
				"type": "object",
				"properties": {
					"name": {
						"type": "string"
					},
					"source": {
						"type": "string"
					},
					"className": {
						"type": "string"
					},
					"classSource": {
						"type": "string"
					},
					"entries": {
						"type": "array",
						"items": {
							"$ref": "../entry.json"
						}
					},
					"entryData": {
						"$ref": "#/definitions/entryDataObject"
					},
					"data": {
						"$ref": "../util.json#/definitions/foundryDataObject"
					},
					"flags": {
						"$ref": "../util.json#/definitions/foundryFlagsObject"
					},
					"advancement": {
						"$ref": "../util.json#/definitions/foundryAdvancementsArray"
					},
					"chooseData": {
						"type": "array",
						"items": {
							"$ref": "../util.json#/definitions/foundryDataObject"
						}
					},
					"isChooseDataRenderEntries": {
						"type": "boolean"
					},
					"isIgnored": {
						"const": true
					},
					"actorDataMod": {
						"type": "object"
					},
					"actorTokenMod": {
						"type": "object"
					},
					"effects": {
						"$ref": "../util.json#/definitions/foundryEffectsArray"
					},
					"img": {
						"type": "string"
					},
					"subEntities": {
						"$ref": "../util.json#/definitions/foundrySubEntitiesObject"
					}
				},
				"required": [
					"name",
					"source",
					"className",
					"classSource"
				],
				"additionalProperties": false
			}
		},
		"classFeature": {
			"type": "array",
			"items": {
				"type": "object",
				"properties": {
					"name": {
						"type": "string"
					},
					"source": {
						"type": "string"
					},
					"className": {
						"type": "string"
					},
					"classSource": {
						"type": "string"
					},
					"level": {
						"type": "integer"
					},
					"entries": {
						"type": "array",
						"items": {
							"$ref": "../entry.json"
						}
					},
					"entryData": {
						"$ref": "#/definitions/entryDataObject"
					},
					"data": {
						"$ref": "../util.json#/definitions/foundryDataObject"
					},
					"flags": {
						"$ref": "../util.json#/definitions/foundryFlagsObject"
					},
					"chooseData": {
						"type": "array",
						"items": {
							"$ref": "../util.json#/definitions/foundryDataObject"
						}
					},
					"isChooseDataRenderEntries": {
						"type": "boolean"
					},
					"isIgnored": {
						"const": true
					},
					"actorDataMod": {
						"type": "object"
					},
					"actorTokenMod": {
						"type": "object"
					},
					"effects": {
						"$ref": "../util.json#/definitions/foundryEffectsArray"
					},
					"img": {
						"type": "string"
					},
					"subEntities": {
						"$ref": "../util.json#/definitions/foundrySubEntitiesObject"
					}
				},
				"required": [
					"name",
					"source",
					"className",
					"classSource",
					"level"
				],
				"additionalProperties": false
			}
		},
		"subclassFeature": {
			"type": "array",
			"items": {
				"type": "object",
				"properties": {
					"name": {
						"type": "string"
					},
					"source": {
						"type": "string"
					},
					"className": {
						"type": "string"
					},
					"classSource": {
						"type": "string"
					},
					"level": {
						"type": "integer"
					},
					"subclassShortName": {
						"type": "string"
					},
					"subclassSource": {
						"type": "string"
					},
					"entries": {
						"type": "array",
						"items": {
							"$ref": "../entry.json"
						}
					},
					"entryData": {
						"$ref": "#/definitions/entryDataObject"
					},
					"data": {
						"$ref": "../util.json#/definitions/foundryDataObject"
					},
					"flags": {
						"$ref": "../util.json#/definitions/foundryFlagsObject"
					},
					"chooseData": {
						"type": "array",
						"items": {
							"$ref": "../util.json#/definitions/foundryDataObject"
						}
					},
					"isChooseDataRenderEntries": {
						"type": "boolean"
					},
					"isIgnored": {
						"const": true
					},
					"actorDataMod": {
						"type": "object"
					},
					"actorTokenMod": {
						"type": "object"
					},
					"effects": {
						"$ref": "../util.json#/definitions/foundryEffectsArray"
					},
					"img": {
						"type": "string"
					},
					"subEntities": {
						"$ref": "../util.json#/definitions/foundrySubEntitiesObject"
					}
				},
				"required": [
					"name",
					"source",
					"className",
					"classSource",
					"level",
					"subclassShortName",
					"subclassSource"
				],
				"additionalProperties": false
			}
		}
	},
	"required": [
		"class",
		"subclass",
		"classFeature",
		"subclassFeature"
	],
	"additionalProperties": false
}